taf_02345_00348037167	ஆஸ்த்ரேலியப் பெண்ணுக்கு முப்பத்தி மூன்று ஆண்டுகளுக்குப் பின்னர் இந்தியா இழப்பீடு வழங்கியது
taf_07049_00155837462	ஸ்ரீரங்கம் கோவிலில் வெடிகுண்டு மிரட்டல்
taf_09705_01218130267	உங்களுடைய உணவுக் கட்டுப்பாட்டைச் சொன்னால் மற்றவர்களுக்கும் உதவியாக இருக்கும்
taf_03219_00712757493	ரஹானே மட்டும் ஆறுதலாக முப்பத்தி ஆறு ரன்கள் குவித்தார்
taf_00008_01305524612	மனோரமாவிற்கு பூபதி என்ற மகன் உள்ளார்
taf_04125_01507228128	பணம் திசை திருப்பப்பட்டதை வங்காளதேசத்தின் கிராமின் வங்கி மறுக்கிறது
taf_07910_01584356993	ஏர் இந்தியா குண்டுவெடிப்பு சூத்திரதாரி பொய்சாட்சிய வழக்கில் குற்றவாளியாகத் தீர்ப்பு
taf_07894_00517992937	ஆசியான் நாடுகளின் புதிய மனித உரிமை அமைப்பு
taf_04696_00523634279	நூற்றி ஐம்பது மீட்டரில்
taf_05001_00531982185	கா‌ரி‌ல் அம‌ர்‌ந்தபடியே மெ‌ரினா கட‌ற்கரை‌யி‌ல் அமை‌க்‌க‌ப்ப‌ட்டு‌ள்ள ‌சிற‌ப்பு‌ப் ப‌ணிகளை ஆ‌ர்வ‌த்துட‌ன் சு‌ற்‌றி‌ப்பா‌ர்‌த்தா‌ர்
taf_01484_01055566125	இந்திய அணி நூற்று இருபத்தாறு ரன்கள் எடுத்து அபார வெற்றி பெற்றுள்ளது
taf_02027_01350099461	குறிப்பாக ஆண் மூலம் அரசாளும் பெண் மூலம் நிர்மூலம் போன்ற உவமைகள் ஜோதிடத்தில் எங்கும் கூறப்படவே இல்லை
taf_02042_01490052249	ஆஸ்த்திரேலியத் துடுப்பாட்ட அணியின் தலைமைப் பதவியில் இருந்து ரிக்கி பாண்டிங் விலகினார்
taf_02345_01664073518	இமாச்சலப் பிரதேசப் பழங்குடியினர் கிரேக்க மன்னன் அலெக்சாண்டரின் வாரிசுகளா?
taf_02330_00096194830	சிங்கப்பூரில் உலகின் முதலாவது அறிவுக்கலை அருங்காட்சியகம்
taf_09689_00036562162	எகிப்தில் மக்கள் போராட்டத்தை அடுத்து அரசைக் கலைத்தார் முபாரக்
taf_06478_01490963620	முதலில் தயங்கியவர் பின்னர் அதனை செய்வதாக ஒப்புக்கொண்டார்
taf_02027_00150647812	போலியோ அற்ற நாடாக இந்தியா அறிவிப்பு
taf_02027_00554998467	ஸ்ரீ கிருஷ்ணா டாக்கீஸ் என்ற பட நிறுவனம் சார்பில் விஎம்
taf_02345_01052998033	ஜனவரி முப்பது தியாகிகள் தினம்
taf_02042_02042842418	தமிழகத்தில் வாக்காளர் எண்ணிக்கை ஐந்து புள்ளி முப்பத்தியேழு கோடியை எட்டியுள்ளது
taf_06958_00360322187	எத்தியோப்பியாவில் மிகப் பழமையான மனித எலும்புக்கூடு கண்டுபிடிக்கப்பட்டது
taf_04125_01909453453	இரண்டாயிரத்து இரண்டு பாலி குண்டுவெடிப்பு சந்தேக நபரை பாக்கிஸ்தான் நாடு கடத்தியது
taf_03822_01234946154	விக்கிலீக்ஸ் நிறுவனர் அசானிற்கு எக்வடார் அரசு புகலிடம் அளித்தது
taf_03219_00279311328	வழக்கை வாபஸ் வாங்குவதில் எனக்கு எந்தப் பிரச்சனையும் இல்லை என்று பூச்சி முருகன் நேற்றிரவே தெரிவித்துவிட்டார்
taf_07910_00205494685	ரேபீஸ் நோயை கட்டுப்படுத்த புதிய மருந்து கண்டுபிடிப்பு
taf_07910_01902313674	ரசிகர்கள் விரும்பும் எந்த வேடத்திலும் நடிப்பேன்
taf_08213_01061328793	நானும் ரவுடிதான் படத்தை திரையிட்ட எல்லா தியேட்டர்களில் இருந்தும் நல்ல தகவல்கள் வந்து கொண்டிருக்கின்றன
taf_06478_01863177583	விக்கட் கீப்பர் ஸ்டம்பிங் செய்தார்
taf_06958_01781151721	பழைய வாடிக்கையாளர்களைத் தக்க வைத்துக் கொள்ளுங்கள்
taf_07910_01119711285	மதி இறுக்க நோயின் மரபணு மூளைத் தொடர்பு கண்டுபிடிப்பு
taf_06796_01737054861	எண்ணூறு மீட்டரில்
taf_02330_01477284103	முதல் இருபத்தி ஐந்து பந்துகளில் ஐந்து விக்கெட்டை ஆஸ்திரேலிய அணி இழந்தது குறிப்பிடத்தக்கது
taf_00008_01936138624	
taf_02330_00593692103	விவசாய துறையிலும் குறிப்பிட்ட இடத்தை வகிக்கிறது
taf_02027_01869260670	அசிசியின் புனித பிரான்சிசின் கல்லறை புனரமைக்கப்பட்டது
taf_05572_01404637802	ஆப்பிள் நிறுவனத்தின் மொத்த மதிப்பு நூற்று எழுபது பில்லியன் சுமார் பதினோறு இலட்சம் கோடி டாலர் ஆகும்
taf_02330_00986024482	சுவாமியை தரிசனம் செய்யலாம்
taf_06796_01149542469	முந்நூறு அடியில்
taf_07049_01000943968	பாகிஸ்தான் அணியில் அதிகபட்சமாக சோயிப் மாலிக் முப்பத்தி ஐந்து ரன்களும் முகமது ரிஷ்வான் முப்பத்தி மூன்று ரன்களும் எடுத்தனர்
taf_02916_01089469132	இந்திய அணி தனது முதல் இன்னிங்ஸில் இருநூற்று ஒன்று ரன்களுக்குள் ஆல் அவுட் ஆனது
taf_08213_01854752015	துலாம் ராசிக்காரர்கள் சூடாக சாப்பிடுவார்கள்
taf_02042_00156958591	மும்பை பங்குச் சந்தையில் நடைபெற்ற வர்த்தகத்தில் சென்செக்ஸ் முன்னூற்று ஒன்பது புள்ளிகள் அதிகரித்து இருபத்தி ஐந்தாயிரத்து எண்ணூற்று மூன்று புள்ளிகளாக நிலைபெற்றது
taf_04125_01912166381	சிரியா கலவரங்களில் தொன்னூறு பேர் உயிரிழப்பு பலர் காயம்
taf_09705_00202379033	ஐ பி எல் கிரிக்கெட் போட்டியில் சூதாட்டம் நடந்ததாக குற்றச்சாட்டுகள் எழுந்தது
taf_06958_01034666893	சூடான் தலைவர் ஒமர் அல் பஷீர் தெற்கு சூடானுக்கு அரசு முறைப் பயணம்
taf_05572_00936918719	மூலம் நட்சத்திரத்தைப் பொறுத்தவரை ஆனி மூலம் அரசாளும் பின் மூலம் நிர்மூலம் என்று மட்டுமே கூறப்பட்டுள்ளது
taf_02027_00921458099	இரண்டாயிரத்து பன்னிரண்டு ஆசியக் கோப்பை துடுப்பாட்டத் தொடர் வங்காளதேசத்தில் ஆரம்பம்
taf_02042_01760598220	இரண்டாயிரத்து பத்து இந்தியன் பிரிமியர் லீக் கோப்பையை சென்னை சூப்பர் கிங்ஸ் அணி வென்றது
taf_05001_01352899148	மேலதிக சிகிச்சைக்காக ரஜினிகாந்த் சிங்கப்பூர் பயணம்
taf_02916_00860891678	பதினேழாம் நூற்றாண்டு இலங்கை சுங்கான் பென்ட்டி லண்டனில் அதிக விலைக்கு ஏலம் போனது
taf_02330_01226603971	மார்கழி குளிருக்கு பயந்து இரவில் கோலமிடுவது சரியா
taf_07049_00886251955	இடைத்தரகர்களை நம்பி பணம் கொடுத்து ஏமாறாதீர்கள்
taf_09705_00568089413	ஏப்ரல் ஏழு உலக சுகாதார தினம்
taf_04125_00590113850	சூடானில் கடத்தப்பட்ட இரு பன்னாட்டு தொண்டு நிறுவனப் பணியாளர்கள் விடுதலை
taf_05001_01589540990	நான் திருமணத்துக்கு இன்னும் தயாராகவில்லை
taf_09689_00638631168	செப்டம்பர் பதினான்கு இந்திய மொழிகள் தினம்
taf_05572_00856539668	நீளமுள்ள புறவழிச்சாலையும் அடங்கும்
taf_07049_01448890280	தரையில் சண்டை போட்ட இளைய தளபதி ஒருகட்டத்தில் தாவி கிரேனில் ஏறி சண்டை போடுவதாக எடுத்தனர்
taf_02330_01999810042	இந்தோனேஷியக் காட்டுத்தீயால் சிங்கப்பூர் புகை மூட்டத்தில் மூழ்கியது
taf_08213_00648673881	தங்கத்தின்மீதுள்ள மோகம் மேலும் கூடும்
taf_02027_01562798374	நெ‌ல்லை‌யி‌ல் க‌ல்லூ‌ரிகளு‌க்கான செம‌ஸ்ட‌ர் தே‌ர்வு ‌தி‌ட்ட‌மி‌‌ட்டபடி நடைபெறு‌ம் எ‌ன்று அ‌றிவிக்க‌ப்ப‌ட்டு‌ள்ளது
taf_02027_00381748383	உலகத் தமிழ் செம்மொழி மாநாடு கோவையில் தொடங்கியது
taf_02330_00200700426	மார்ச் இருபத்தி நான்கு உலக காசநோய் தினம்
taf_02330_01346317740	சுட்டிக்காட்டி இதற்கு உடனடித்தீர்வு காண்பது மிகவும் அவசியம் என்று வலியுறுத்தினார்
taf_09705_01694187544	ஜனவரி பத்து உலக சிரிப்பு தினம்
taf_02345_00867346232	விஜயகாந்தை சந்தித்தார் பாடகர் கோவன்
taf_02027_01512024712	சுவாங்கிராயின் எதிர்ப்பை சிம்பாப்வே அதிபர் நிராகரித்தார்
taf_01484_00033474579	நட‌க்க முடியாதவ‌ர்க‌ள் ‌சிலரை அ‌ந்த வ‌ழியாக வ‌ந்தவ‌ர்க‌ள் த‌ங்களது வாகன‌த்‌தி‌ல் ஏ‌ற்‌றி ஊ‌ட்டி மு‌க்‌கிய சாலை‌க்கு கொ‌ண்டு வ‌ந்து ‌வி‌ட்டன‌ர்
taf_03822_01429759810	வெற்றியுடன் வழி அனுப்புவோம் என்று இலங்கை வீரர்கள் கூறியிருந்தனர்
taf_06478_01941131163	அழகு சாதனப் பொருட்களின் விலை உயரும்
taf_02042_01698754140	டிசம்பர் இருபத்தி ஆறு சுனாமி தினம்
taf_06478_01535835840	படம் என்று வெளியாகிறது என்பதை அறிவிக்கும் முன்பே எந்தெந்த திரையரங்குகளில் படம் வெளியாகிறது என்பதை அறிவித்திருக்கிறார்கள்
taf_08213_00967789577	ஒவ்வொரு கிரகத்திற்கும் தனி காரகத்துவம் உள்ளது
taf_05572_00212142286	பரிகாரம் இல்லாத ஜாதக அமைப்புகள் உள்ளதா
taf_06796_01243943467	இடது புறம் குறுக்குமாற்றத்தில் செல்க
taf_09705_00719933722	உலகின் உயரமான பாலம் மெக்சிக்கோவில் அமைக்கப்பட்டது
taf_04696_01614649017	பெரிய நோய்கள் ஏற்படாமல் தடுத்துக் கொள்ள முடியும்
taf_02027_01312378759	என்னிடம் தன்னம்பிக்கையை வளர்த்துவிட்டது
taf_06958_01638821597	மார்கழிப் பனியில் மண்ணும் குளிரும் தைப் பனியில் தரையும் குளிரும் என முன்னோர்கள் கூறியுள்ளனர்
taf_09705_00748601047	நேற்றுவரை இதன் சென்னை மாநகர வசூல் ஒன்று முப்பத்தி ஆறு கோடி
taf_02027_00311509992	உலகில் முதன் முறையாக பிரிட்டிஷ் ஏர்வேஸ் விமானங்களில் வைஃபை சேவை அறிமுகம்
taf_04125_02119007368	தவறாக நினைக்காதீர்கள்
taf_02916_00954545716	விக்னேஷ் சிவனின் நழுவல் பதில்களை நீங்களே படியுங்கள்
taf_07910_00028259894	நிதானமாக ஆடிய மற்றொரு தொடக்க ஆட்டக்காரர் சிபாபா நாற்பத்தி இரண்டு ரன்கள் எடுத்தார்
taf_06478_02049369122	இரண்டாயிரத்து பத்து உலகக்கிண்ணக் கால்பந்துப் போட்டிகள் தென்னாப்பிரிக்காவில் ஆரம்பமாகியது
taf_03219_01437285419	அரசுப் பள்ளிகளில் வழங்கப்படும் கல்வியினை ஆதரிக்கும் பரப்புரை தமிழகத்தில் துவக்கம்
taf_04696_01177707082	வடகிழக்கு நோக்கி
taf_06478_01978668829	ஒரு சிலருக்கு ரத்த தானம் செய்ய உடல்நிலை ஒத்துழைக்காது
taf_02027_00972178455	ஆஸ்த்திரேலியப் பெண்ணுக்கு முப்பத்தி மூன்று ஆண்டுகளுக்குப் பின்னர் இந்தியா இழப்பீடு வழங்கியது
taf_05572_00827829432	இந்தியாவில் விக்கிப்பீடியாவின் பணிமனை திறக்கப்படும் என ஜிம்மி வேல்ஸ் அறிவிப்பு
taf_07367_01778110704	சீனா உலகின் இரண்டாவது பெரும் பொருளாதாரமாக ஜப்பானை முந்தியது
taf_05572_01287631137	சிலர் நீங்கள் முன்பு போல் இல்லையென்றும் மாறி விட்டதாகவும் கூறுவார்கள்
taf_07352_01891517946	வரி ஒப்பந்தத்தைத் தக்க வைக்க மொரீஷியஸ் இரண்டு தீவுகளை இந்தியாவுக்கு அளிக்க முன்வந்துள்ளது
taf_03822_01920262123	பள்ளி குழந்தைகள் மற்றும் அனைத்து தரப்பு மக்களும் இந்த படகு பயணம்தான்
taf_08213_00480158680	கோலிசோடா என்ற ஒரே படத்தில் ஓஹோவென்று வளர்ந்தவர் விஜய் மில்டன்
taf_03822_01006941177	பதினேழாம் நூற்றாண்டின் சீனத் தாமரைக் கிண்ணம் ஒன்பது மில்லியன் டாலருக்கு ஏலத்தில் விற்பனை
taf_02330_01651382673	வித்தியாசமான படங்கள் தமிழில் வர வேண்டும்
taf_07352_00103100936	விருப்பமான கதை அமைந்தால் சம்பளத்தை குறைத்துக் கொள்வீர்களா
taf_09705_00048893505	தமிழ்நாட்டில் பள்ளிகள் மீண்டும் திறப்பு
taf_01484_01105877621	வேதாளம் படத்தில் அஜித்துக்கு இரட்டை வேடமா
taf_00008_01000484885	ஒல்லியாகவும் இல்லாமல் உயரத்திற்கு ஏற்ற சதைப்பிடிப்புடன் இருப்பார்கள்
taf_04696_00465519815	ரமணா திரைப்படத்தில் வரும் கதாபாத்திர பேராசிரியர் பணி ஓய்வு கண் கலங்கிய மாணவர்கள்
taf_02345_00250754593	ரங்கராஜபுரம் மேம்பால‌த்‌தை ‌திற‌ந்தா‌ர் ஜெயல‌லிதா
taf_05572_01503190237	இந்த துறைமுகத்தை சார்ந்தே தூத்துக்குடி பகுதியும் அதனை சுற்றியுள்ள பகுதிகளும் உள்ளன
taf_03822_00304267978	இஸ்ரேல் எகிப்து இடையில் புதிய தடைச் சுவர்
taf_08213_00699062800	சோமாலியக் கடற்கொள்ளையர்களால் கடத்தப்பட்ட ப்ரித்தானியத் தம்பதியர் விடுவிப்பு
taf_09705_00490394979	பொது வாழ்வில் ஆசிரியரையும் மருத்துவரையும் மிகவும் மரியாதைக்கு உரியவர்களாக மக்கள் கருதுகின்றனர்
taf_00008_01683776119	ஏப்ரல் ஏழு உலக சுகாதார தினம்
taf_07352_00021693668	சந்தோஷப்பட வேண்டிய நேரத்தில் சரியாக ஆப்பு அடிப்பதை சிலர் செவ்வனே செய்து வருகிறார்கள்
taf_08213_00615974115	கிரகங்களையும் பார்க்க வேண்டும்
taf_04125_00189904551	விஷாலின் ரசிகர் மன்றம் மூலமாக வெள்ள நிவாரணம் வழங்கும் சோனா
taf_03219_01510056611	ஜூன் பதினெட்டு உலக தந்தையர் தினம்
taf_02345_00890182018	உங்களுக்குப் பிடிக்காத பிற விஷயங்கள்
taf_01484_01246278785	கர்நாடக அரசின் இந்த முடிவுக்கு தமிழகம் கடும் எதிர்ப்பு தெரிவித்து வருகிறது
taf_03219_01806830722	ஹசாரேயுடன் பேச்சு நடத்தத் தயாரென பிரதமர் அறிவிப்பு
taf_04696_01541874475	நூறு கெஜத்தில்
taf_09689_01411134245	வெனிசுலா தேர்தலில் எதிர்க்கட்சி பெரும்பான்மை பலத்தைப் பெற்றது
taf_08213_00954550009	சீனாவும் அமெரிக்காவும் ஒட்டுமொத்தமாக தங்கள் புவிவெப்ப வாயு வெளியேற்றத்தை குறைக்க ஒப்புக்கொண்டிருக்கின்றன
taf_02027_00139617642	அதிவேகமாக வெப்பமயமாகும் ஆர்க்டிக் துருவம்
taf_07894_00355534257	மூல நோய்க்கு குணம் தரும் இயற்கை மருத்துவம்
taf_05572_00064995181	அதிமுக மகளிர் அணி நிர்வாகிகள் திடீர் மாற்றம்
taf_04696_00917342668	காடு மலை நதிகளை காப்பாற்ற புதிய சட்டங்கள் நடைமுறைக்கு வரும்
taf_05572_01882413707	அவருடைய காதலை மனோரமா ஏற்றுக்கொண்டார்
taf_07049_01425972499	பாலத்தைக் காதலித்து திருமணம் செய்த வினோதம்
taf_07367_00985430088	அல்ஜீரியா முதல்தடவையாக இரண்டாம் சுற்றுக்குத் தெரிவானது
taf_07894_01018422172	சின்ன வயதில் தான் படித்த நகரி அரசு உயர்நிலைப் பள்ளியின் ஆண்டுவிழாவில் அவர் கலந்து கொண்டார்
taf_02042_01164080217	திமிங்கில வேட்டையை மீண்டும் தொடங்குகிறது ஜப்பான்
taf_03219_01025215692	தரையில் சண்டை போட்ட இளைய தளபதி ஒருகட்டத்தில் தாவி கிரேனில் ஏறி சண்டை போடுவதாக எடுத்தனர்
taf_03219_01884179675	ஆப்பிரிக்காவில் சந்தித்த விஞ்ஞானிகள் புவி வெப்பமடைதலின் அபாய விளவுகளை எதிர்கொள்ளத் தயாராகுங்கள் என்று எச்சரிக்கை விடுத்துள்ளனர்
taf_02042_00139288689	உங்களுக்கும் நயன்தாராவுக்கும் ரகசிய திருமணம் நடந்ததாக கூறப்படுவது உண்மையா
taf_03822_00936537321	இஸ்லாம் மதத்திற்கு மாறினார் இசையமைப்பாளர் யுவன் ஷங்கர் ராஜா
