taf_02330_01900854449	இன்று எல்லா பங்குகளின் விலைகளும் அதிகரிக்கும்
taf_09689_00028907924	சபையில் பேசும் போது கூட முதலில் பேசத் தயங்குவார்கள்
taf_09705_00463152576	மலாலாவுக்கு ஐரோப்பிய ஒன்றியத்தின் சாகரோவ் மனித உரிமை விருது
taf_02916_01633518694	அபாரமாக ஆடிய விராட் கோலி நூற்று பனிரண்டு பந்துகளில் நூறு ரன்களை கடந்தார்
taf_09705_00798797468	வகையாற்றின் குறுக்கே கட்டப்பட்டுள்ள பெரியாறு அணையை பென்னி குயிக் என்பவர் கட்டிமுடித்தார்
taf_02027_00298263443	கால்பந்து விளையாட்டில் சிறப்பு பெற சனியின் ஆசி வேண்டும்
taf_03822_00018977162	விஜய்யை கடலில் தள்ளிய எஸ்ஏ
taf_03219_00156006704	மெயின் அருவிக்கரை பகுதியில் க‌ட்டட‌ம் க‌ட்ட ஆலோசனை நடத்தப்பட்டு வருகிறது
taf_09705_00179140431	ஜனவரி முப்பது தியாகிகள் தினம்
taf_07894_00580372376	ஐம்பது புள்ளிகளை தொட்டது
taf_07894_02110794319	சீனா உலகின் இரண்டாவது பெரும் பொருளாதாரமாக ஜப்பானை முந்தியது
taf_01484_01464008937	அண்டார்டிக்காவில் சிக்கிய ரஷ்யக் கப்பலை மீட்க ஆஸ்திரேலிய பனி உடைப்புக் கப்பல் விரைகிறது
taf_08213_00121582212	நிலத்தடி நீர்மட்டம் அதலபாதாளத்திற்குப் போய்விடும்
taf_03822_00663476511	இலங்கையில் மக்களைக் காப்பதில் ஐநா பெருந்தோல்வி உள்ளக அறிக்கை
taf_02027_01893830532	பொதுவாக மழைக்காலத்தில் குறிப்பாக வடகிழக்குப் பருவமழைக் காலங்களில் மட்டும் இவ்வாற்றில் நீர்ப்பெருக்கு ஏற்படும்
taf_04125_00313877520	ஆப்கானிஸ்தான் பாகிஸ்தானில் ஆறுஇரண்டு ரிக்டர் நிலநடுக்கம்
taf_02345_01826711118	ஏமனில் அரசு அறிவித்த போர் நிறுத்தம் கடைபிடிக்கப்படவில்லை
taf_06958_01771360181	சிறு துயரமும் இவர்களை பெரியளவில் பாதிக்கும்
taf_00008_01209821033	சடலத்தை கொண்டு சென்ற ஆம்புலன்ஸ் விபத்து மூன்று பேர் பலி
taf_04696_01991087227	லேசாக வலதுபுறத்தில் செல்க
taf_03219_01035546235	சிம்புவுடனான நட்பு எப்படி போகிறது
taf_02916_01408663212	வாகனங்களின் விலை குறையும்
taf_06796_00171045592	ஐம்பது கெஜத்தில்
taf_07894_00422779748	கினி அரசுத்தலைவர் தேர்தல் ஒத்திவைப்பு
taf_05572_00894327697	சோமாலிய அரசுப் படைகள் முக்கிய நகரம் ஒன்றைக் கைப்பற்றினர்
taf_06796_01495785219	தெற்கு நோக்கி
taf_04125_00161200011	நாடாளுமன்றக் கூட்டுக்குழு அமைக்கப்படும்
taf_03219_01084213755	திரைப்படத்தின் ஒரு காட்சியில் சகோதரர்கள் இருவர் பீட்ஸா சாப்பிடுவதற்காக நிலக்கரியை திருடி பணம் சேர்ப்பார்கள்
taf_07910_00571098681	தமன்னா விஜய் சேதுபதியுடன் நடிப்பது இதுவே முதல் முறை
taf_07352_01979496608	ஏப்ரல் இரண்டாம் தேதி வியாழக் கிழமை மகாவீர் ஜெயந்தி
taf_02345_01842249841	கோவில் தேரை எரித்ததும் தலித் வீடுகளைக் கொளுத்தியதும் கண்டனத்துக்குரியதாகும்
taf_02916_00926978334	பாறை எரிவளித் திட்டத்தை தமிழகத்தில் செயல்படுத்தக்கூடாது என்று எதிர்த்து தெரிவிக்க வேண்டும்
taf_02042_01772469140	உங்களுக்கும் மகேஷ் பாபுவுக்கும் என்னதான் சண்டை
taf_08213_00312966264	மே இருபத்தி நான்கு காமன்வெல்த் தினம்
taf_07894_00394467932	இஸ்லாமியக் கிளர்ச்சியாளர்களுடன் தாய்லாந்து அமைதி உடன்பாட்டில் கையெழுத்திட்டது
taf_04696_00789760026	நீங்கள் சேருமிடத்தை வந்தடைவீர்கள்
taf_03219_00844269468	டிசம்பர் இருபத்தி மூன்று புதன் அன்று மிலாதுநபி
taf_07894_01846563648	மலாலாவுக்கு ஐரோப்பிய ஒன்றியத்தின் சாகரோவ் மனித உரிமை விருது
taf_08213_00321675314	விராட் கோலி அவுட்
taf_05572_01808875505	இந்திய விண்கலம் மங்கள்யான் செவ்வாயை நோக்கி ஏவப்பட்டது
taf_05572_01880146795	பூமிக்கு அடியில் உள்ள குழாய் மாற்றி அமைக்கப்பட வேண்டி உள்ளது
taf_08213_00844372750	பல இடங்களில் மின்சாரம் இல்லை
taf_09705_00030598968	கணவரின் பிணத்துடன் மூன்று நாள் வசித்த மனைவி
taf_01484_00710399002	இயேசுநாதர் காலத்து வீடு இசுரேலில் கண்டுபிடிப்பு
taf_03219_00722151744	
taf_07352_01277747317	இந்த துறைமுகத்தை சார்ந்தே தூத்துக்குடி பகுதியும் அதனை சுற்றியுள்ள பகுதிகளும் உள்ளன
taf_02330_00845794681	உதாரணமாக அலுவலகத்திலேயே சிறந்த பணியாளர் எனப் பெயர் பெற்றிருந்தாலும் பதவி உயர்வு கிடைக்காது
taf_03822_00147469250	மருத்துவத்துக்கான இரண்டாயிரத்து பதினொன்று நோபல் பரிசு மூவருக்கு வளங்கபட்டுலது
taf_02042_00144221624	லெபனானில் இசுலாமியப் போராளிகளின் தாக்குதலில் பதினாறு படையினர் கொல்லப்பட்டனர்
taf_00008_00276634770	திருப்பதியில் செம்மரக்கட்டை கடத்த முயன்ற நான்கு தமிழர்கள் கைது
taf_04125_01330178538	லிபிய ராணுவ வாகன அணி எல்லையைத் தாண்டி நைஜரை அடைந்தது
taf_00008_00246952766	அண்ணா பல்கலைக்கழக தேர்வுகள் மீண்டும் ஒத்திவைப்பு
taf_03822_01040044406	கருங்கல்லில் நாதசுரம் வடிவமைத்த நாமக்கல் சிற்பி சாதனை
taf_06958_00551089065	தீ விபத்துக்கான காரணம் தெரியவில்லை
taf_05572_00485683437	தமிழகத்தில் பாரதிய ஜனதா கட்சியின் தலைமையிலான கூட்டணி இறுதிவடிவம் பெற்றுள்ளது
taf_02330_01989228272	பெண்களை மதிக்க வேண்டும் இளங்கோவனுக்கு தமிழிசை சவுந்தராஜன் வாழ்த்து
taf_02330_00755237889	பெருமாளுக்கு உரிய கிரகம் புதன்
taf_00008_00378423926	மார்ச் இருபத்தி மூன்று உலக வானிலை தினம்
taf_04125_00160662718	ஜனாதிபதியைப் பதவி விலகக் கோரி ஏமனிலும் போராட்டம்
taf_08213_02025677944	டெல்லியில் எலெக்ட்ரிக் பேருந்து சேவையை துவக்கி வைத்த மோடி
taf_02916_00482544936	
taf_08213_01639203584	வின் சர்வதேச வானிலை மாற்றக் குழு எச்சரிக்கை விடுத்துள்ளது
taf_06478_02044449196	இன்னும் சில தினங்களில் வேதாளத்தின் ட்ரெய்லரை வெளியிட உள்ளனர்
taf_04125_01474240324	சிம்ரன் படத்தில் வில்லியாக ரம்யா கிருஷ்ணன்
taf_07352_00369080899	பேத்திக்கு திருமணம் செய்ய திட்டமிட்டு உள்ளதாகவும் வரன் எப்படி அமையும் எனத் தெரிந்து கொள்ள வந்ததாகவும் என்னிடம் தெரிவித்தார்
taf_05001_00792326331	தயக்கமே இல்லாமல் எந்திரன் இரண்டில் நடிக்க ஒப்புக் கொண்டார் ரஜினி
taf_01484_01838644397	புதிய செய்தி சிம்ரன் நடிக்கும் படத்தில் ரம்யா கிருஷ்ணன் வில்லியாக நடிக்கிறார்
taf_02042_01005864343	மறக்க முடியாத அனுபவம்
taf_03219_00793534845	பிரபல பின்னணிப் பாடகர் கே ஜே யேசுதாசுக்கு ஸ்ரீ நாராயண விருது
taf_02042_00689210938	பதினெட்டு பேருடன் சென்ற இந்தோனேசிய விமானம் சுமாத்திராவில் வீழ்ந்தது
taf_06958_02017428140	பின்னர் மார்டின் கப்திலும் பதினைந்து ரன்கள் வெளியேறினார்
taf_05001_00062382628	கொல்கத்தா ரோடுகளில் அஜித் ஓடியதும் இத்தாலி கப்பலில் ரிஸ்க்கான காட்சியில் நடித்ததும் மறக்க முடியாது
taf_06478_00198497760	ரசிகர்களின் ரகளைக்கு இடையில் பாகிஸ்தான் அபார வெற்றி
taf_04125_00171819319	லிபியாவில் எரிபொருள் தாங்கி வெடித்ததில் நூற்றுக்கும் அதிகமானோர் உயிரிழப்பு
taf_04125_01578022004	முதுபெரும் இந்தி நடிகர் பிரானுக்கு பால்கே விருது
taf_02916_01579403087	குற்றவுணர்வுக்கு ஆளான டிம்மின் கதாபாத்திரம் ஒருகட்டத்தில் தன்னைத்தானே மாய்த்துக் கொள்கிறது
taf_07367_00622302091	ஏப்ரல் பன்னிரண்டு உலக வான் பயண தினம்
taf_04125_01395276015	பிரபுதேவாவும் படத்தில் நடித்தவர்களும் இது எங்களுக்கு பார்ட்டி டைம் என்று பேட்டியளித்துள்ளனர்
taf_06958_00373673937	கிளைமாக்ஸ் எடுத்த பிறகு இரண்டு நாள் கழிச்சு எனக்கு அது அவ்வளவா பிடிக்கலை
taf_08213_01133256588	தாமதத்திற்கான காரணத்தைக் கண்டறிந்து அதன் அடிப்படையில் அதற்கு காரணமானவர்கள் மீது நடவடிக்கை எடுக்க நெடுஞ்சாலை ஆணையத்திற்கு உத்தரவிடப்பட்டுள்ளது
taf_07352_00704377905	நிவின் பாலிக்கு அப்படியே நேரெதிர்
taf_05572_00004408500	நிலத்தடி நீர்மட்டம் கீழே சென்றுவிடுவதால் அப்பகுதி முற்றிலும் வறட்டு பாலைவனமாகப் போய்விடும் ஆபத்து உருவாகும்
taf_03822_00660646281	விஜய் மற்றவர்களுக்கு உதவும் பண்பு கொண்டவர்
taf_06958_00956657263	திருத்தந்தையின் வருகையை அடுத்து கியூபாவில் புனித வெள்ளி விடுதலை நாளாக அறிவிப்பு
taf_03219_01015262957	அருணாச்சலப் பிரதேசத்தில் கோரோ என்ற புதிய மொழி கண்டுபிடிக்கப்பட்டுள்ளது
taf_06478_00398503981	கடன் சுமையுள்ள நாடுகளில் இந்தியாவுக்கு ஐந்தாவது இடம்
taf_00008_01913351969	வெறும் கண்களால் பார்க்கக்கூடிய முப்பரிமாணத் தொலைக்காட்சி
taf_07049_00097116080	பய‌ணிக‌ளி‌ன் வச‌தி‌க்காக செ‌ன்னை எழு‌ம்பூ‌ரி‌ல் இரு‌ந்து மதுரை‌க்கு ‌சிற‌ப்பு ர‌யி‌ல் நாளை இய‌க்க‌ப்படு‌கிறது
taf_09689_00582860568	இந்தியத் துடுப்பாட்ட வீரர் சச்சினுக்கு பாரத் ரத்னா விருது
taf_02916_00510863939	அமெரிக்க சுதந்திரதேவி சிலையைப் போல் மதுரையில் தமிழ்த்தாய் சிலை ஜெயலலிதா அறிவிப்பு
taf_07064_00414079375	கோடை விடுமுறையில் இந்த கோரத்தாண்டவத்தை ரசிகர்கள் திரையில் கண்டு களிக்கலாம்
taf_05572_01714482787	உலகக்கோப்பை கால்பந்தில் இங்கிலாந்து மெக்சிகோ அணிகள் இரண்டாம் சுற்றில் தோல்வி
taf_06478_02072327163	இந்த ரயில் நிலையத்தின் தண்டவாளங்கள் சராசரியாக முன்னூறு மீட்டர்கள் அளவுடையது
taf_02330_00581492523	அழிந்து வரும் மேற்கு ஆப்பிரிக்க சிங்கங்கள்
taf_05572_00065922620	சூழல் மாசடைவதைத் தடுக்க கரிம உமிழ்வுக்கு வரி அறவிட ஆஸ்திரேலியா திட்டம்
taf_09689_01205550707	பாகிஸ்தான் தரப்பில் ஷோயப் மாலிக் இரண்டு விக்கெட்டுகளை கைப்பற்றினார்
taf_04125_00236484448	அடுத்து வந்த ஆண்டர்சன் ரோஞ்சி இருவரும் டக் அவுட் ஆகி வெளியேறினர்
taf_05572_00257891504	தஞ்சாவூர் பெரிய கோயில் ஆயிரமாவது ஆண்டு நிறைவு விழா
taf_05572_01787596114	சிலருக்கு வாழ்க்கையே சின்னாபின்னமாகி விடுகிறது
taf_07910_01062745485	தில்லியில் பத்தொன்பதுவது பொதுநலவாயப் போட்டிகள் கோலாகலமாக ஆரம்பம்
taf_09705_01374094515	நான் நிறைய படங்கள் நடித்திருக்கிறேன் ஆனால் இந்த படம் என் சினிமா வாழ்க்கையில் முக்கியமான படம்
taf_05001_01265600256	பழைய தியாகிகளின் படங்களும் ரூபாய் நோட்டில் இடம் பெறும்
taf_02345_00801073100	கடந்த ஆண்டு அக்டோபர் மாதம் வரை இயக்குவதற்கு திட்டமிட்டிருந்த ரயில்வே நிர்வாகம் இந்த ஆண்டு ஜனவரி மாதம் வரை சிறப்பு ரயில்களை இயக்கியது
taf_05001_00818467807	முதன்முறையாக தேர்தல் பிரச்சாரத்தில் சவுதி பெண்கள்
taf_04125_00858301427	சூரியனைச் சுற்றி வரும் புதிய புறக்கோள் கண்டுபிடிப்பு
taf_04125_00512539425	அந்தப் படம் பாதியிலேயே நின்றுவிட்டது
taf_03822_00925437551	மே மூன்று உலக சக்தி தினம்
taf_02027_01192299902	பெரு அரசுத்தலைவர் தேர்தலில் தேசியவாத வேட்பாளர் உமாலா வெற்றி
taf_06958_00838809983	ஐரானுக்கெதிரான ஐக்கிய நாடு சபையின் மூன்றாவது பொருளாதாரத் தடை
taf_04125_01586209669	தூங்கா வனம் முடிந்ததால் அவர் செய்த உடனடி விஷயம் கெட்டப்பை மாற்றியது
taf_03822_01439198462	செப்டம்பர் பதினேழு வியாழக் கிழமை விநாயகர் சதுர்த்தி
taf_06796_02117660913	கால் மைலில்
taf_01484_00241460648	உச்ச நீதிமன்றத்தில் அம்பானி சகோதரர்கள் விவகாரம்
taf_07352_01289786503	சிலர் கல்லூரியில் கற்பித்த பேராசிரியரை மறக்க மாட்டார்கள்
taf_07910_00339913936	வரும் பண்டிகை காலங்களை முன்னிட்டு ப்ளிப்கார்ட் நிறுவனம் பிக் பில்லியன் டேஸ் சேல் என்பதை ஆரம்பித்துள்ளது
taf_04125_01477138259	ஹன்சிகா நடித்துள்ள புலி நாளை வெளியாகிறது
taf_03822_01930679230	தமிழக விளையாட்டு வீரர்களுக்கான ஊக்கத் தொகையை உயர்த்த ஜெயலலிதா முடிவு
taf_01484_01961011224	குருபகவானின் நட்சத்திர சஞ்சாரம்
taf_02345_00123871996	அஸ்லான்ஷா கோப்பை ஹாக்கி முதல் சுற்றில் இந்தியா நியூசிலாந்திடம் தோல்வி
taf_06796_01203168983	நீங்கள் சேருமிடம் இடப்பக்கமிருக்கிறது.
taf_02027_00019920640	அனுஷ்காவின் குண்டுத் தோற்றம் அப்படியென்ன படத்தில் சொல்லப் போகிறார்கள் என்ற எதிர்பார்ப்பை ஏற்படுத்தியிருக்கிறது
taf_04125_01072291007	இலங்கையின் முன்னாள் இராணுவத் தளபதி சவேந்திர சில்லாவிற்கு ஐநா ஆலோசகர் பதவி
taf_05572_01256521051	ரசிகர்களை திருப்திபடுத்துவதற்காக மட்டுமே என் முழு வாழ்க்கையும் இல்லை
taf_00008_01106725476	மட்டக்களப்பு வாகரையில் தொல்பொருட்கள் மீட்பு
taf_05572_00745986017	அமெரிக்க சுதந்திரதேவி சிலையைப் போல் மதுரையில் தமிழ்த்தாய் சிலை ஜெயலலிதா அறிவிப்பு
taf_04696_00600148767	உங்கள் இலக்கு இடப்பக்கமிருக்கும்.
taf_02330_01890373584	அந்த கிராமத்தில் மிக பிற்படுத்தப்பட்ட மக்களும் தலித் மக்களும் வாழ்ந்து வருகின்றனர்
taf_02916_00984742217	ஸ்டாலின்கிராத் நகர் போர் நினைவு நாட்களில் தனது பழைய பெயரைப் பெறவிருக்கிறது
taf_04125_02056130274	உடல் நலனை நிர்ணயிக்கும் முக்கிய காரணிகளில் ஒன்றாக உணவு திகழ்கிறது
taf_07367_01255324170	பக்ரைன் குண்டுவெடிப்புகளில் இருவர் உயிரிழப்பு
taf_09689_00393589833	ஐந்து கோடி பேருக்கு குடிநீர் கிடைக்காத நிலை ஏற்படும்
taf_03822_01405500289	பங்கு சந்தை இன்று சரிவுடன் துவங்கியது
taf_03219_00327176860	அமைச்சரின் காரை வழி மறித்து பொதுமக்கள் போராட்டம்
taf_07894_01023878548	மார்ச் எட்டு உலக மகளிர் தினம்
taf_04696_01579771811	நீங்கள் சேருமிடம் வலப்பக்கமிருக்கிறது.
taf_05572_01899541892	பெற்றோரிடம் எதையும் மறைக்க வேண்டாம்
taf_07367_00244996092	தரமான கல்வி கிடைப்பதற்கு ஏதாவது ஒரு வகையில் ஜாதக அமைப்பு காரணமாகிறதா
taf_04696_00602392960	வலைத்தடக் கொள்ளைத் தடை சட்டமூலத்துக்கு எதிராக விக்கிப்பீடியா குரல்
taf_03822_00404946969	சோமாலியா தாக்குதலில் பன்னிரண்டு பேர் உயிரிழப்பு
taf_07049_01586528932	இரண்டாயிரத்து பதினான்காம் ஆண்டு உலகக் கிண்ணக் கால்பந்துப் போட்டி பிரேசிலில் ஆரம்பமானது
