taf_02916_01319318661	இந்தியப் பெருங்கடல் கடற்படை மாநாடு இரண்டாயிரத்து பன்னிரண்டு கொழும்பில் ஆரம்பம்
taf_07894_01707211651	அதன் பின்னரே சென்னை மாநகரம் உருவாகி வளர்ந்தது என்பது குறிப்பிடத்தக்கது
taf_07910_02104467449	கென்யாவின் வறண்ட துர்க்கானா பகுதியில் நீர்த்தேக்கம் கண்டுபிடிப்பு
taf_07049_01445252031	குவாண்டானாமோ விரிகுடாவில் உள்ள அமெரிக்கத் தடுப்பு முகாமுக்கு பத்து ஆண்டுகள் நிறைவு
taf_02042_00031947200	தூதுக்கோள் என்றும் புதன் அழைக்கப்படுகிறது
taf_07064_01676875335	தாங்களாகவே முன்வந்து உதவி செய்த ரஜினி ரசிகர்கள் இயக்குனர் பொன்ராம் நெகிழ்ச்சி
taf_06796_00382409866	குறுக்குமாற்றத்தில் செல்க
taf_07910_00220776011	தமிழகம் முழுவதும் மேற்கொண்ட ஆய்வில் அனைத்து சாலைப் பணிகளும் வெகு விரைவாக நடைபெற்று வருவது தெரியவந்துள்ளது
taf_09689_00189679484	இலங்கைக்கு முதல் தங்கம்
taf_05572_01507345553	நான் திமிர் பிடித்தவள் அல்ல நித்யா மேனன் பேட்டி
taf_04696_00339730685	மழையை பார்த்த பிறகு நம்மை சுத்தி உள்ள மக்கள் எல்லாம் நல்லாயிருந்தா போதும்ங்கிற மைன்ட் செட்டுக்கு வந்துட்டோம்
taf_01484_01194875272	எனக்கே அது அதிர்ச்சியாக இருந்தது
taf_06958_01857352978	முத்தரப்பு ஒருநாள் துடுப்பாட்டத் தொடரில் ஆத்திரேலியா இறுதிப் போட்டிக்கு முன்னேற்றம்
taf_07352_01848587719	கணவன் ஒரு கேள்வி கேட்டால் அதற்கு மனைவி சொல்லும் பதிலும் மனைவி ஒரு கேள்வி கேட்டால் அதற்கு கணவன் சொல்லும் பதிலும் முக்கியமானது
taf_07064_02027737352	அங்கோலா தேர்தலில் ஆளும் மக்கள் விடுதலை இயக்கம் வெற்றி
taf_09705_00655788867	வெளிநாட்டுப் பயணிகளை கவரும் வண்ணம் புதிய விமானங்கள் இயக்கப்படும்
taf_05572_00005981213	டிசம்பர் ஏழு கொடி தினம்
taf_07367_01442338160	இந்திய அறிவியலாளர்கள் புதிய புற்றுநோய் சிகிச்சை முறையைக் கண்டுபிடித்தனர்
taf_05001_01338188938	அவருடைய காதலை மனோரமா ஏற்றுக்கொண்டார்\\\\
taf_02345_01225725133	தமிழ் திராவிட மொழிக் குடும்பத்தின் துணைப் பிரிவுகளுள் ஒன்றாகும்
taf_05001_00014067057	கோயில் சொத்தை அபகரித்தவர்களுக்கு இதுபோன்ற ஜாதக அமைப்பில் குழந்தைகள் பிறக்காது
taf_07894_00383068492	கென்யா அரசுத்தலைவர் தேர்தலில் உகுரு கென்யாட்டா வெற்றி
taf_04125_01894252814	வேறு படங்களில் ஷங்கர் கவனம் செலுத்தினார்
taf_02916_01247887039	அனுஷ்காவின் குண்டுத் தோற்றம் அப்படியென்ன படத்தில் சொல்லப் போகிறார்கள் என எதிர்பார்ப்பை ஏற்படுத்தியிருக்கிறது
taf_06478_00491523894	லோதரில் வெற்றி பெற்ற திருடர் காவல்துறை கைது
taf_09689_01579330672	தற்சமயம் இவருக்கு ஏழரைச் சனியும் நடக்கிறது
taf_02345_02055055860	பக்ரைன் ஆர்ப்பாட்டங்களுக்கு உள்துறை அமைச்சகம் தடை
taf_05572_00277709311	லிபியா மீது மேற்குலக நாடுகள் வான் தாக்குதல்
taf_07352_00998655719	சூடானுக்கும் தெற்கு சூடானுக்கும் இடையில் அமைதி உடன்பாடு எட்டப்பட்டது
taf_07910_01627048438	ஆயிரத்தி தொள்ளாயிரத்தி பதினைந்து ஆர்மேனிய இனப்படுகொலை குறித்து ஃப்ரெஞ்ச் சட்டமூலத்திற்கு துருக்கி எதிர்ப்பு
taf_03822_00789011748	எயிட்டியின் முன்னாள் அரசுத்தலைவர் இருபத்தி ஐந்து ஆண்டுகளுக்குப் பின்னர் நாடு திரும்பினார்
taf_00008_01562108675	மணிரத்னத்தின் மௌனராகம் படத்தில் பெண் பார்க்க வரும் மோகன் வீட்டில் காத்திருக்க மழையில் உற்சாக நடனம் போடுவாரே ரேவதி
taf_04125_00100060674	சுக்கிரன் மோசமாக இருந்தால் காதலில் தோல்வி திருமணத்திற்கு பின் குறுகிய காலத்தில் பிரிவு போன்ற சம்பவங்கள் ஏற்படும்
taf_07049_00869881102	பங்குசந்தை இன்று ஏற்றத்துடன் தொடங்கியது
taf_05572_00002624928	ஒரு ரசிகனாக என்னுடைய வாழ்த்துக்களை கூறி விட்டேன்
taf_00008_00832899920	தலித் மக்கள் வசிக்கும் பகுதிக்குள் அவர்கள் வழிபடும் மாரியம்மன் கோவில் அமைந்துள்ளது
taf_00008_01769553736	வண்டலூர் அருகேயுள்ள நலம்பாக்கம் ஏரி உடைந்தது
taf_07367_00413734325	ஆஸ்த்திரேலியாவை நோக்கி சென்ற படகு விபத்துக்குள்ளானதில் இருநூறு பேரைக் காணவில்லை
taf_02345_01973528432	கிரகங்கள் என்று சொன்னால் அந்த கிரகங்கள் எந்த நட்சத்திரத்தில் இருக்கின்றது என்பதை பார்க்க வேண்டும்
taf_06796_00286310711	உங்கள் இலக்கு வலப்பக்கமிருக்கும்.
taf_02042_01317561850	புதிய அரசியலமைப்புக்கு எகிப்து மக்கள் ஒப்புதல் அளித்தனர்
taf_03822_00456470054	காயமடைந்தவர்கள் அருகிலுள்ள மருத்துவமனையில் சிகிச்சைக்காக அனுமதிக்கப்பட்டுள்ளனர்
taf_04696_01485469679	ஒரு மைலில்
taf_05572_01039753990	ஸ்ரீபெரும்புதூர் நோக்கியா செல்போன் நிறுவனம் வரும் நவம்பர் மாதம் முதல் மூடப்பட உள்ளது
taf_05572_01292525732	நெற்றியில் இருக்கும் கோடுகளையெல்லாம் வைத்து சில விஷயங்களை சொல்லலாம்
taf_02027_00450367145	தயக்கமே இல்லாமல் எந்திரன் இரண்டில் நடிக்க ஒப்புக் கொண்டார் ரஜினி
taf_09705_01219817840	விராட் கோலி முதல் வெற்றி
taf_09705_01475589774	குடியிருப்பு பகுதிகளில் வெள்ளம் சூழ்ந்துள்ளதால் அங்கிருந்து மக்களை பாதுகாப்பான இடங்களுக்கு காவல்துறையினர் அனுப்பி வருகின்றனர்
taf_06478_01947777552	காவல்துறை அதிகாரிகள் அப்பகுதியில் பாதுகாப்பு பணியில் ஈடுபட்டுள்ளனர்
taf_04696_00743656054	இந்தியா மூன்று ஓவர்களுக்கு பதினொன்று ரன்கள் எடுத்து விளையாடி வருகிறது
taf_02027_01555771691	ஐம்பது ஓவர்கள் முடிவில் பாகிஸ்தான் அணி நான்கு விக்கெட் இழப்பிற்கு முன்னூற்று பதினாறு ரன்கள் குவித்தது
taf_06958_01405818442	உலகத் தமிழ் செம்மொழி மாநாட்டினை ஒட்டி தமிழ் விக்கிப்பீடியாவிற்கு கட்டுரை எழுதும் போட்டி
taf_04696_00264752599	அரை மைலில்
taf_06478_01224430903	திருச்செந்தூரிலுள்ள முருகன் கோவிலில் இருவரும் திருமணம் செய்துகொண்டனர்
taf_09689_01766185106	மட்டக்களப்பு வாகரையில் தொல்பொருட்கள் மீட்பு
taf_06958_01304789319	வில்லன் வழக்கமான பழிவாங்கல் என பழகிய பார்முலாக்குள் படம் எடுப்பதால் ரசிகர்கள் ஏமாற்றமடைந்துள்ளனர்
taf_07352_01325641901	அலைக்கற்றை ஊழல் வழக்கில் ஐந்து பேருக்கு பெயில் வழங்கப்பட்டது
taf_06796_00418445295	முக்கால் மைலில்
taf_06796_00074442666	முந்நூறு கெஜத்தில்
taf_07910_01747768790	சிறுவயதிலிருந்தே பாடுவதில் ஆர்வம் பெற்று விளங்கினார்
taf_05572_01072669103	இந்திய அணி தனது முதல் இன்னிங்ஸில் இருநூற்று ஒன்று ரன்களுக்கு ஆல் அவுட் ஆனது
taf_07910_01774238848	எனக்கு போட்டியாக நான் என்னை தான் நினைக்கிறேன்
taf_06478_01013852068	அருணாச்சலப் பிரதேஷத்தில் தொங்கு பாலம் விழுந்ததில் பலர் உயிரிழப்பு
taf_01484_00234163212	அவரது திரைவாழ்க்கையில் முக்கியமான திரைப்படமாக தி சைலன்ஸ் கருதப்படுகிறது
taf_08213_01680916961	நட்சத்திரப் பொருத்தம் என்பது ஒரு தொடக்கம்
taf_07367_01163539809	படம் விரைவில் வெளிவரவிருக்கும் நிலையில் பத்திரிகையாளர்களை சந்தித்தார் தனுஷ்
taf_06478_01202925900	தென்மேற்குப் பருவமழை பொய்த்துவிட்டதால் காவிரியின் குறுக்கே உள்ள அணைகளில் நீரின் இருப்பு குறைவாக உள்ளது
taf_02916_00603064549	ஸ்ரீ விஜய் வித்யாலயா கலை அறிவியல் கல்லூரியில் முன்னூறு பேர் பங்கேற்ற விக்கிப்பீடியா பயிலரங்கம்
taf_04125_00361914131	இன்னும் அறுபது தினங்கள் கூடுதலாக தந்திருக்கிறாராம்
taf_02345_01697726243	கமலின் ரியாக்ஷன் எப்படியிருந்தது
taf_07894_01260044122	மருந்துகள் விலைக்குறையும்
taf_04125_01266644386	இஸ்லாமியருக்கு எதிரான திரைப்படம் தயாரித்தவர் அமெரிக்காவில் கைது
taf_06478_00241972995	தொன்மையான எகிப்தியக் கைவினைப் பொருட்கள் ஸ்பெயினில் மீட்பு
taf_06958_00315990181	குழாய்கள் மாற்றி அமைக்கப்பட்ட பிறகு இந்த மேம்பால பணி தொடங்கும்
taf_06796_01396439885	ஒன்றரை மைலில்
taf_04125_00316747746	பிற காலங்களில் பொதுவாக வறண்டே காணப்படும்
taf_04696_00944048452	விண்மீனை சுற்றி கரிம விண்பந்துகள் கண்டுபிடிக்கப்பட்டன
taf_02027_00579919442	லிபியாவுக்கு எதிராக ஐநா பொருளாதாரத் தடை
taf_07049_00811624855	சிலியில் பெரும் நிலநடுக்கம்
taf_09705_00428992218	கத்திப்பாராவில் தூண்கள் இல்லாமல் பாலம் அமைக்கும் பணி நடந்து வருகிறது
taf_07049_01529551855	ஐநூறு ஆண்டுகள் பழமையான திரு காளகஸ்தி சிவன் கோயில் இராசகோபுரம் இடிந்து விழுந்தது
taf_04125_00397253842	பள்ளிப் பாடம் நடத்திய ஆசிரியருக்கு உதவலாம்
taf_03822_00796391725	ஹரப்பா காலத்து எலும்புக்கூடுகள் கண்டுபிடிப்பு
taf_08213_02032056698	நான் ரஜினியின் தீவிர ரசிகன் தனுஷ் பேட்டி
taf_05572_01501288446	எந்திரனில் வரும் ரயில் சண்டைக் காட்சியிலும் ரோபோ பிரேக் டான்ஸ் ஆடும் காட்சியிலும் டூப் தான்
taf_05572_01212524472	பவானி ஆற்றை கடக்க இந்த பாலம் முக்கியமானதாக விளங்குகிறது
taf_06958_01229540603	சேலத்தில் ஆடி முதல் நாளை முன்னிட்டு தேங்காய் சுடும் விழா
taf_02042_00764490774	வெனிசுவேலா தலைவர் மதுரோவுக்கு சிறப்பு அதிகாரங்கள் வழங்கப்பட்டன
taf_08213_00981844649	படம் வரும் இருபத்தி ஒன்றாம் தேதி வெளியாகிறது
taf_07352_02145437269	மிகவும் நன்றாக நடனம் ஆடுவார்
taf_09705_00333212449	மீத்தேன் திட்டம் சில ஆயிரம் அடி ஆழத்தில் சாதாரண நிலையில் இருக்கும் மீத்தேன் வாயுவை பிரித்து எடுப்பதாகும்
taf_07910_00549771799	இந்த ரயில் நிலையத்தின் தண்டவாளங்கள் சராசரியாக முன்னூறு மீட்டர்கள் அளவுடையது
taf_06958_01700700879	மழை அவர்களின் திட்டத்தை கலைத்திருக்கிறது
taf_02330_01387807788	சிரிய அகதிகள் பல்லாயிரக்கணக்கில் ஈராக்கிய குர்திஸ்தான் சென்றனர்
taf_04125_02034835919	பாலியல் வல்லுறவை போர் ஆயுதமாக வகைப்படுத்தி ஐநா தீர்மானம்
taf_03219_00612983286	இரண்டாயிரத்து பதினொன்று உலகக்கோப்பை காலிறுதிப் போட்டிகள் ஆரம்பம்
taf_04125_00867013745	அமெரிக்காவில் ஒளிபரப்பாகும் தொலைக்காட்சி தொடர் ஒன்றில் ப்ரியங்கா நடித்து வருகிறார்
taf_08213_01962490920	மாயா ஊழியை நம்பும் பல்லாயிரக்கணக்கானோர் மெக்சிக்கோவில் கூடினர்
taf_07367_00385020736	‌விடுமுறை நா‌ட்க‌ளி‌ல் மு‌க்‌கியமான ஊ‌ர்க‌ளி‌ல் இரு‌ந்து வேட‌ந்தா‌ங்கலு‌க்கு ‌சிற‌ப்பு பேரு‌ந்துகளை இய‌க்‌கினாலு‌ம் வச‌தியாக இரு‌க்கு‌ம்
taf_05572_01973331469	ஆர் படங்களில் அவர் பாடுவது மாதிரியே வேறு குரலில் பாடுவார்
taf_03219_00856409001	ரஷ்ய ஆர்க்டிக் பகுதியிலும் இதன் தாக்கம் அதிகரித்து வருகிறது
taf_02330_00099628992	கரிபியன் பகுதியில் படகு மூழ்கியதில் பலர் இறப்பு
taf_07049_01958651224	மாணவர்களின் கல்வி கற்கும் அணுகுமுறையில் கிரகங்களின் தாக்கம் இருக்கிறதா
taf_02042_01056324814	தவறாக நினைக்காதீர்கள்
taf_02042_01624547443	வணிக ரீதியாக தூத்துக்குடி துறைமுகம் சென்னை துறைமுகத்தை விட அதிகமாக பயன்படுத்தப்படுகிறது
taf_07894_01385742331	துருக்கியில் மீண்டும் நிலநடுக்கம் பலர் உயிரிழப்பு
taf_04125_00532489076	பணப்புழக்கம் ஓரளவு அதிகரிக்கும்
taf_07352_01899055107	பங்கு சந்தைகளில் திடீர் சரிவு
taf_02916_00711607357	உலகின் மிகக் குறைந்த விலை வீடுகளை அமைக்க டாட்டா நிறுவனம் திட்டம்
taf_04125_00332217700	பிரபல ஓவியர் எம்எப்ஹுசைன் லண்டனில் காலமானார்
taf_07352_02053858698	இரண்டாயிரத்து பன்னிரண்டு ஆசியக் கிண்ணத்தை பாக்கிஸ்தான் அணி வென்றது
taf_04125_01427409664	பாம்பன் ரயில் பாலத்துக்கு வெடிகுண்டு மிரட்டல்
taf_03822_00822064760	கடாஃபியின் இளைய மகன் நேட்டோ வான் தாக்குதலில் கொல்லப்பட்டார்
taf_06958_02115000730	படத்தின் பாடல்களும் படமும் சிறப்பாக இருக்கும்
taf_05572_00479797882	ஆர்க்டிக்கில் தனது பகுதியை உறுதிப்படுத்துவதற்கு ரஷ்யா இரண்டாவது கப்பலை அனுப்புகிறது
taf_03219_00162986193	செ‌ன்னை அடு‌த்து‌ள்ள மகாப‌ல்லிபுர‌த்‌தி‌ல் உ‌ள்ள கட‌ற்கரை கோ‌விலையு‌ம் த‌ண்‌ணீ‌ர் ‌வி‌ட்டு வை‌க்க‌வி‌ல்லை
taf_04125_02053139966	போனால் சி‌ரித்துவிட்டு வரலாம் என்று திரையரங்குக்கு செல்கிறவர்களே அதிகம்
taf_02916_00548374261	டைரக்டர் எல்லாவிதத்திலும் ஒத்துழைப்பு தந்தார்
taf_05572_01815241612	அமெரிக்கா மத்திய ஆப்பிரிய குடியரசுக்கான தனது தூதரகத்தை மூடியது
taf_05572_02104778550	போப்பாண்டவர் ஐக்கிய இராச்சியம் செல்கிறார்
taf_03219_01985794843	சத்யஜோதி ஃபிலிம்ஸ் தயாரிப்பில் நடிக்கும் அஜித்
taf_02345_01690310208	தற்போது பாபநாசம் அணையில் இருந்து வெளியேற்றப்படும் தண்ணீரின் அளவு அதிகரிக்கப்பட்டுள்ளது
taf_02042_01279597597	சமோவா நாட்காட்டி ஒரு நாள் முன்னே செல்ல இருக்கிறது
taf_07049_00770699472	நட்சத்திரப் பொருத்தத்தைப் பார்த்துவிட்டு ஜாதகப் பொருத்தத்தைப் பார்க்காமல் இருந்துவிடலாகாது
taf_09705_01222130832	வெப்பமடைதலுக்கு பூமியை விட விண்வெளி விரைவாக வினையாற்றுகிறது
taf_07910_01211564001	முதல் ஓவரிலேயே அவுட்டானது அதிர்ச்சிகரமாக அமைந்தது
taf_07049_01578879744	இந்த தூண்கள் கட்ட நான்காயிரம் டன் சிமெண்ட் பயன்படுத்தப்பட்டது
taf_07064_00018436857	நடித்த எந்தப் படத்திலும் வேதாளம் அளவுக்கு நடிப்பில் ஸ்கோர் செய்தது இல்லை
taf_03219_02081561691	மென்மையான ஓசையுடைய எழுத்துக்கள் மெல்லினம்
taf_05001_00544694526	நீங்கள் விரைவில் திருமணம் செய்யப் போவதாக பேச்சிருக்கிறதே
taf_03822_01764872024	தனது பெண்களுக்கு ஏற்பட்டுள்ள தோஷத்திற்கு என்ன பரிகாரம் செய்யலாம் எனக் கேட்டார்
taf_06958_01008075842	சமஸ்கிருதத்தை ஒலிபெயர்ப்பதற்கு இலத்தீன் வரிவடிவங்களைப் பயன்படுத்தும் பல முறைகள் உள்ளன
taf_03219_00031317038	நூலக வித்தகர் வே தில்லைநாயகம் காலமானார்
