taf_02042_01788778378	வாடிக்கையாளர்கள் அனைவரும் ஹோண்டா விநியோகஸ்தர்களை தொடர்பு கொண்டு இந்த சேவையினைப் பெறலாம் என்று அந்நிறுவனம் கூறியுள்ளது
taf_07910_00607340635	சென்னை உள்ளிட்ட பல்வேறு மாவட்டங்களில் பள்ளி கல்லூரிகளுக்கு இன்று விடுமுறை
taf_02345_01420597931	உலகின் இரண்டாவது உயரமான கட்டடம் மக்காவில் கட்டப்படுகிறது
taf_04696_00940435436	ரவுண்டானாவை உள்ளிடுக
taf_03219_02116484997	உங்களுக்குப் பிடிக்காத பிற விஷயங்கள்
taf_07894_01872920788	ஜனவரி இருபத்தி ஐந்து தேசிய வாக்காளர் தினம் தேசிய சுற்றுலா தினம்
taf_01484_01647935310	சில பங்குகள் அதிக எண்ணிக்கையில் வர்த்தகம் ஆனதாகவும் தெரிவித்துள்ளனர்
taf_06478_01659909859	மகனுக்கு வெளிநாட்டில் வேலை கிடைக்கும்
taf_03219_01844529775	விக்கிலீக்ஸ் யூலியன் அசான்ச் லண்டனில் கைது செய்யப்பட்டார்
taf_02916_00260829319	புதிய நீதிபதிகளும் நியமிக்கப்படுவார்கள்
taf_07367_01899111701	கல்கியின் பொன்னியின் செல்வன் புதினம் நாடகமாக அரங்கேறவிருக்கிறது
taf_06796_01520878832	யூ-வளைவில் செல்க
taf_07049_01701127197	தென்கிழக்கு ஈரானில் பெரும் நிலநடுக்கம் பலர் உயிரிழப்பு
taf_02330_00964498858	விலை உயர்ந்த தங்க ஆபரணங்களை யாருக்கும் இரவல் தரவோ வாங்வோ வேண்டாம்
taf_03822_00011641098	பழம்பெரும் திரைப்பட இசையமைப்பாளர் டி கே இராமமூர்த்தி காலமானார்
taf_05572_02040094040	ஏடன் வளைகுடாவில் கடற்கொள்ளையை முறியடித்தது மலேஷியக் கடற்படை
taf_00008_01629086082	நான் முதலில் ரஜினியின் தீவிர ரசிகன்
taf_05572_00418320082	கொங்கோ போராளிகள் கோமோ நகரினுள் நுழைந்தனர்
taf_09689_00866189430	கமல்ஹாசன் படத்தில் அது இடம்பெற்றது
taf_09689_00145187220	உங்களை சுற்றியிருப்பவர்களில் சுயநலவாதிகள் யார் என்பதைப் புரிந்துக் கொள்வீர்கள்
taf_04696_02045458888	நாநூறு கெஜத்தில்
taf_03219_00705500645	வாய்ப்பு கிடைத்தால் நிச்சயம் நடிப்பேன்
taf_03219_00354664989	திருச்சி நகரின் முக்கிய அடையாளமாக திகழும் பெல் நிறுவனம் நாற்பது வருடங்கள் இயங்கி வருகின்றது
taf_01484_01930726570	கொல்கத்தா ரோடுகளில் அஜித் ஓடியதும் இத்தாலி கப்பலில் ரிஸ்க்கான காட்சியில் நடித்ததும் மறக்க முடியாது
taf_05572_00680828146	வேற்று மதத்தினர் அயல்நாட்டில் வசிப்பர்களை ஆதிக்கம் செய்யும் கிரகங்களாக சனி ராகு கருதப்படுகிறது
taf_06478_01523487262	இந்த ரயில் நிலையத்தின் மொத்த நீளம் தொள்ளாயிரம் மீட்டர் என்பது குறிப்பிடத்தக்கது
taf_04125_01804612642	வழிபாட்டுத் தலங்களை கட்டுவதற்கு புதிய சட்ட விதிகள் அமலுக்கு வரும்
taf_07352_00552709260	நான் குண்டாகவும் குள்ளமாகவும் இருப்பதாகக் கூறுகிறார்கள்
taf_02330_01154016534	கோவில்களில் அர்ச்சனை செய்யும்பொழுது கூட உங்களுடைய ஜாதி என்ன என்று கேட்கப்படுவதில்லை என்ன நட்சத்திரம் என்றுதான் கேட்கப்படுகிறது
taf_04125_00685285679	ஏப்ரல் இருபத்தி ஒன்று இந்திய ஆட்சிப்பணி தினம்
taf_04125_00033069500	சட்டத்திற்கு புறம்பான ஹவாலா உள்ளிட்ட பணப்பட்டுவாடாவை தடுக்க புது சட்டங்கள் வரும்
taf_07049_00092207407	குறிப்பாக கன்னி ராசிக்காரர்களுக்கு மிளகாய் மூக்கு இருப்பதையெல்லாம் பார்க்கிறோம்
taf_02330_00749938725	பீஹார் சட்டசபை கலைக்கப்பட்டபொழுது அப்துல் கலாம் பதவி விலக விரும்பினார் உதவியாளர் தகவல்
taf_04125_00065466576	மற்றவர்கள் சொல்கிறார்கள் என்று தெரியாத துறையில் இறங்க வேண்டாம்
taf_06478_01680742533	சிறுபான்மை இனத்தவர் அனைத்துத் துறையிலும் முன்னேறுவார்கள்
taf_07894_01272749002	விஜய்யை கடலில் தள்ளிய எஸ்ஏ
taf_04125_01397524357	ரசிகர்கள் வழக்கமான எதிர்பார்ப்புடன் பசங்க இரண்டு படத்துக்கு வர வேண்டாம் சூர்யா பேட்டி
taf_04696_00224460772	ஆர் சிவாஜிக்கு பாடுவது என்பது சிம்ம சொப்பனம்
taf_06478_01173808585	இந்திய நடுவன அமைச்சர் தயாநிதி மாறன் பதவி விலகினார்
taf_02330_00286166496	ஆயுதம் கடத்திய குற்றத்திற்காக வங்காளதேச எதிர்க்கட்சித் தலைவருக்கு தூக்குத்தண்டனை தீர்ப்பு
taf_04125_02047790752	பெரும் நஷ்டத்தில் சோனி நிறுவனம்
taf_06796_01715263176	தரவு இணைப்பு துண்டிக்கப்பட்டது
taf_07352_01076507614	ஹைதராபாத்தில் கமல் செய்தியாளர்களுக்கு பேட்டியளித்தார்
taf_03822_00243917270	பிளமிங்கோ பறவைகளுக்கு கால்கள் மற்றும் வாய்‌ப்பகுதி சிவப்பு நிறத்திலும் உடல் பகுதி வெள்ளை நிறத்திலும் இருக்கிறது
taf_02042_01774473525	பல்வேறு வகையான ஹோமம் யாகங்கள் இருந்தாலும் அவற்றை எல்லாம் விட தியாகமே சிறந்த பலனை அளிக்கும் என முன்னோர்கள் கூறியுள்ளனர்
taf_01484_00232196777	ரொம்ப வருஷமா இந்த நாளுக்காகத்தான் காத்திருந்தேன் அதர்வா பேட்டி
taf_06478_01581308359	இந்தியக் காஷ்மீர் குண்டுவெடிப்பில் மதத்தலைவர் உயிரிழப்பு
taf_02330_01538395597	கொஞ்சம் கடுமையாக இருப்பேன்
taf_07367_02146013513	கடலோர மாவட்டங்களில் கனமழை பெய்யும்
taf_02345_00732633938	ரஞ்சித் இயக்கத்தில் ரஜினி நடித்துவரும் கபாலி படத்திற்கு ரஜினி அறுபது நாட்கள் கால்ஷீட்டு தந்துள்ளார்
taf_09705_01967093181	என்னடா இது நம்ம டைம் சரியே இல்லையேன்னு நினைச்சேன்
taf_06958_01981112360	நாள் ஒன்றுக்கு முப்பது கிலோ மீட்டர் தொலைவுக்கு சாலை அமைக்க அரசு திட்டமிட்டுள்ளதாகவும் நிதின் கட்கரி தெரிவித்துள்ளார்
taf_07049_01400489565	முப்பத்தி ஒன்பது ரன்களுக்குள் மூன்று விக்கெட்டுகளை இழந்து தடுமாறிக் கொண்டிருந்தது
taf_02042_00366118184	வாகனங்களை இலவசமாக பழுது பார்க்கும் முகாம் நீட்டிப்பு
taf_02042_00443746019	டிசம்பர் பத்து மனித உரிமைகள் தினம்
taf_03219_00686536161	மராத்திய கீறல்கள் பதினோராம் நூற்றாண்டின் கற்களிலும் தாமிரத் தகடுகளிலும் காணப்படுகின்றன
taf_06958_01909196310	அமெரிக்காவில் வால் ஸ்ட்ரீட் ஆக்கிரமிப்பு போராட்டங்கள் நாடெங்கும் பரவியது
taf_04125_01560708183	இந்த ரயில் நிலையம் மொத்தம் பதினைந்து நடைமேடைகளை கொண்டிருக்கும்
taf_07352_01086856231	சோஷலிசத்தை நோக்கிய பாதையில் வெனிசுவேலாவில் புதிய தொழிலாளர் கூட்டம் நடைமுறைக்கு வந்தது
taf_05572_00750855402	ஜாதக பொருத்தம் என்பது மிகுந்த அவசியமாகிறது
taf_03219_00301908468	சம்மந்தப்பட்ட கோயிலுக்கு அன்னாபிஷேகம் செய்யுங்கள்
taf_07049_00427015456	பழைய வீட்டை சீர் செய்வீர்கள்
taf_02345_01196915300	சக்சஸ் மீட்டிலும் நயன்தாரா கலந்து கொள்ளவில்லை
taf_02330_01231034246	மே பதினாறு உலக தொலைக்காட்சி தினம்
taf_03219_00849023095	வீரம் படம் முடிந்ததும் உடனே அடுத்தப் படம் பண்ணலாம் என்று அஜித் உங்களிடம் கூறினார்
taf_03219_02054762491	எப்படி எடை குறைந்தது பழைய இளமைக்கு திரும்பினீர்கள்
taf_05001_02087780489	இருபத்தியோர் பொருத்தம் பார்த்து மணப் பொருத்தம் செய்தார்
taf_02330_00524672191	செப்டம்பர் பதினாறு உலக ஓசோன் தினம்
taf_05001_01821392839	மாணவர்களுடைய விழிப்புணர்வு அதிகமாகும்
taf_04125_01699557548	போதைப் பொருட்களால் பெண்கள் அதிகம் பாதிப்பு நந்திதா தாஸ்
taf_04696_01700098254	வலதுபுற பாதை வழியே செல்க
taf_07910_00700422697	காசாவில் இசுரேல் நடத்திய வான் தாக்குதலில் பன்னிரண்டு பாலத்தீனியர்கள் உயிரிழப்பு
taf_07910_00621186663	அதிகபட்சமாக ஜேபி டுமினி முப்பத்தி ஐந்து ரன்களும் ஹார்மர் பதின்மூன்று ரன்களும் எடுத்தனர்
taf_00008_00869754964	கொசோவோ விடுதலை சட்டபூர்வமானது என பன்னாட்டு நீதிமன்றம் தீர்ப்பு
taf_02027_01083917961	ஜூலை ஒன்று மருத்துவர் தினம்
taf_04125_00444914850	உலகத் தமிழ் செம்மொழி மாநாடு நிறைவடைந்தது
taf_06796_01794429267	எண்ணூறு அடியில்
taf_03219_00358445999	இரண்டு புதிய மூலகங்களுக்கான பெயர்கள் முன்மொழியப்பட்டன
taf_02330_00539368013	முதலிடத்தில் தனுஷின் தங்கமகள்
taf_07352_01007113018	தலை சம்மந்தப்பட்ட நோய்களை குணப்படுத்த புதிய மருந்துகள் கண்டறியப்படும்
taf_04696_01745638020	தமிழகத்தின் கடலோர மாவட்டங்களில் கனமழை பெய்ய வாய்ப்பிருப்பதாக வானிலை ஆய்வுமையம் தெரிவித்துள்ளது
taf_02042_00135187232	கொங்கோவில் மோதல்கள் காரணமாக ஐம்பதாயிரம் பேர் இடம்பெயர்வு
taf_04696_00206607865	பாக்கித்தானின் பெண்கள் பள்ளி ஒன்றுக்குள் புகுந்த நபர்கள் மாணவியர் ஆசிரியைகளைத் தாக்கினர்
taf_02916_02033237639	பல முன்னணி விளையாட்டு வீரர்களின் ஜாதகத்தைப் பார்த்ததில் இதில் உண்மை இருப்பது கண்டறிந்தோம்
taf_04125_01078399506	எனக்கே அது அதிர்ச்சியாக இருந்தது
taf_02330_01549589161	இந்தியாவின் பொருளாதாரத்தை அமெரிக்க மத்திய வங்கியின் அறிவிப்பு பாதிக்காது
taf_01484_00012429950	கிளைமாக்ஸ் எடுத்த பிறகு இரண்டு நாள் கழிச்சு எனக்கு அது அவ்வளவா பிடிக்கலை
taf_02345_01950597333	மற்ற படங்களைப் பற்றி செய்திகள் எதுவும் வெளிவரவில்லை
taf_05572_01285513146	மத்திய அரசின் பத்ம ஸ்ரீ விருது பெற்றார்
taf_07894_01889424695	நான் குண்டாகவும் குள்ளமாகவும் இருப்பதாகக் கூறுகிறார்கள்
taf_07910_00854880878	என்னிடம் தன்னம்பிக்கையை வளர்த்துவிட்டது
taf_02345_00695044124	தருமி என்ற புதிய படத்திற்கு இசை அமைத்துக் கொண்டிருக்கிறேன்
taf_03822_01575494494	இந்த ஆண்டு தொடக்கத்தில் இருந்து மாதம் தோறும் இரண்டு ஆயிரம் கோடி வரை வர்த்தகம் நடைபெற்றது
taf_04125_02097763913	புலி ட்ரெய்லர் அறுபது லட்சம் ஹிட்ஸ்களை தாண்டியது
taf_04125_02111950853	புலி படத்தில் ஸ்ரீதேவி ஷ்ருதிஹாசனுடன் நடித்தது புதிய அனுபவம்
taf_04125_01173237005	காந்தி சிலை அருகில் அழகிய நீரூற்றுகள் அமைக்கப்பட்டுள்ளன
taf_09705_00908594272	ஒரு இளைஞன் பெண்ணை கேலி செய்வது போலவும் அழகை வர்ணிப்பது போலவும் அந்த பாடல் இருந்தது
taf_04125_00733467023	தூண்களில் ஈரப்பதத்துக்கு போட்டு இருந்த சாக்கு மற்றும் பாதுகாப்புக்கு போட்டு இருந்த வலைகள் தீப்பிடித்து எரிந்தன
taf_02330_00301485657	மணப்பெண் கருப்பாக இருப்பதால் இருபது சவரன் அதிகமாக வரதட்சனை கேட்ட வாலிபர்
taf_06958_01304226432	தகவல் தொழில் நுட்பத்துறையிலும் துணை நிறுவனம் உள்ளது
taf_02027_00501107178	ஊகோ சாவேசுவின் வாழ்க்கை படமாகிறது அமெரிக்கர் ஆலிவர் ஸ்டோன் இயக்குகிறார்
taf_07894_00164825721	மிகப் பழமையான மாயன் காலத்துக் கல்லறை குவாத்தமாலாவில் கண்டுபிடிக்கப்பட்டது
taf_05572_00139470674	இரண்டாயிரத்து பதினொன்று கனடா பொதுத்தேர்வில் பழமைவாதிகள் மீண்டும் வெற்றி
taf_07910_00399770856	தானியங்கி அல்பா நாய் அறிமுகம்
taf_08213_01051500427	உடனடியாக நடிகர் சங்க கட்டிடத்தை கட்டியாக வேண்டும்
taf_04696_00437265878	பாதை வழி செல்க
taf_09689_00237866259	சென்னை அணியின் கேப்டன் கைது கோவா காவல் துறை அதிரடி
taf_05572_01269454637	தேசிய சாலை பாதுகாப்பு ஆணையகம் மாநில அரசின் அதிகாரங்களை பறித்துவிடும்
taf_02916_02098927136	கருங்கல்லில் நாதஸ்வரம் வடிவமைத்து நாமக்கல் சிற்பி சாதனை
taf_04696_00457391419	வலதுபுறம் லேசாக வளைந்து சரிவில் செல்க
taf_05001_00414162158	பங்குச்சந்தை இன்று ஏற்றத்துடன் நிறைவடைந்தது
taf_03822_00858403829	ஜெர்மனி நான்காவது தடவையாக உலகக்கோப்பையை வென்றது
taf_04125_01579491989	சிவகார்த்திகேயன் சிறப்பாக வளர்ந்திருப்பது பெருமையாக கருதுகிறேன்
taf_02345_01321063822	முதலாவது இளையர் ஒலிம்பிக் போட்டிகள் சிங்கப்பூரில் ஆரம்பம்
taf_07049_00220511700	நாடகத்தில் இவருடைய பாட்டையும் நடனத்தையும் பார்த்த அனைவரும் இவரை வெகுவாகப் பாராட்டினார்கள்
taf_07049_00661997340	சென்ற வாரம் வெளியான இப்படம் முதல் மூன்று தினங்களில் நாற்பது லட்சங்களை வசப்படுத்தியுள்ளது
taf_03219_01005913928	தமன்னா விஜய் சேதுபதியுடன் நடிப்பது இதுவே முதல் முறை
taf_02345_01003760266	பன்னாட்டுக் காற்பந்தாட்டக் கழகங்களின் கூட்டமைப்பின் தலைவராக பிளாட்டர் மீண்டும் தேர்வு
taf_07910_00799347732	படப்பிடிப்பில் ரயில் மற்றும் ரெயில் நிலையங்களில் ஏதாவது பாதிப்பு ஏற்பட்டால் அதற்கு படப்பிடிப்பு குழுவினரே பொறுப்பாவார்கள்
taf_02330_00546485611	கடன் சுமையுள்ள நாடுகளில் இந்தியாவுக்கு ஐந்தாவது இடம்
taf_03219_00350319865	பேரறிவாளனுக்கு கண் பரிசோதனை செய்யப்பட்டு சிகிச்சை அளிக்கப்பட்டது
taf_09689_00809643303	வெள்ளை அறிக்கை வெளியிடத் தயாரா தமிழக அரசுக்கு ராமதாஸ் சவால்
taf_03822_00147280941	காவிரி ஆற்றை பரிசலில் கடக்கும்போது தண்ணீரில் மூழ்கி இருவர் இறந்தனர்
taf_07352_00587371468	ஏப்ரல் பதினான்கு தமிழ்ப் புத்தாண்டுக்கு படத்தை வெளியிடுவது என்று முடிவு செய்திருக்கிறார்கள்
taf_06478_00296639687	சிலர் தங்களை அறிவாளியாக காட்டிக் கொள்ள உங்களை மட்டம் தட்டி மேலிடத்தில் சொல்லி வைப்பார்கள்
taf_09705_01134054278	மொத்த பாசனப் பரப்பு ஏழாயிரத்து முப்பத்தியோரு சதுர அடி
taf_00008_01999155779	போஸ்டர் பில்டப்புகள் வேண்டாம் என சூர்யா அறிக்கை
taf_04125_02128880390	காசாவில் இஸ்ரேல் நடத்திய வான் தாக்குதலில் பன்னிரண்டு பாலத்தீனியர்கள் உயிரிழப்பு
taf_08213_01173156745	பணியில் திடீர் இடமாற்றம் உண்டு
taf_09705_01169384331	மண்ணின் படைப்பைக் கொண்டாடுவது எங்களின் கடமை
taf_03219_01634976597	தென் ஆப்பிரிக்கா தரப்பில் சிமோன் ஹார்மர் நான்கு விக்கெட்டுகளையும் மோர்னே மோர்கல் மூன்று விக்கெட்டுகளையும் கைப்பற்றினர்
taf_07049_00945659072	தயாரிப்பாளர் சங்கம் இதுபோல் நடக்காமல் ஒரு வரைமுறை படுத்த வேண்டும் என்று பணிவுடன் கேட்டுக்கொள்கிறோம் என்று கூறினார்
taf_03822_01357417000	அமெரிக்காவும் ரஷ்யாவும் அணு ஆயுதங்களைக் குறைப்பதற்கு ஒப்புதல்
